{
  "benchmark_version": "1.0",
  "report_metadata": {
    "report_date": "2026-06-17",
    "patch_reference_date": "2026-06-17",
    "source": "evaluations/2026-06-07 summary"
  },
  "models_evaluated": [
    "claude-opus-4-8",
    "claude-sonnet-4-6",
    "ernie-5.1-preview",
    "gpt-5.5",
    "gpt-5.5-instant",
    "grok-4.3",
    "minimax-m2.7"
  ],
  "total_questions": 3,
  "summary": {
    "overall_ranking": [
      {
        "model": "gpt-5.5",
        "avg_score": 4.3,
        "std": 0.0
      },
      {
        "model": "gpt-5.5-instant",
        "avg_score": 3.575,
        "std": 0.0
      },
      {
        "model": "claude-opus-4-8",
        "avg_score": 3.55,
        "std": 0.0
      },
      {
        "model": "claude-sonnet-4-6",
        "avg_score": 2.95,
        "std": 0.0
      },
      {
        "model": "grok-4.3",
        "avg_score": 1.4,
        "std": 0.0
      },
      {
        "model": "minimax-m2.7",
        "avg_score": 1.4,
        "std": 0.0
      },
      {
        "model": "ernie-5.1-preview",
        "avg_score": 1.3,
        "std": 0.0
      }
    ],
    "by_main_case": {
      "ANALYZE": {
        "avg_score": 3.625,
        "evaluated_answers": 2
      },
      "HOWTO": {
        "avg_score": 2.4,
        "evaluated_answers": 2
      },
      "INFO": {
        "avg_score": 2.5,
        "evaluated_answers": 4
      }
    },
    "by_sub_element": {
      "EXPLORE": {
        "avg_score": 2.4667,
        "evaluated_answers": 6
      },
      "LORE": {
        "avg_score": 3.625,
        "evaluated_answers": 2
      }
    },
    "by_difficulty": {
      "advanced": {
        "avg_score": 3.0125,
        "evaluated_answers": 4
      },
      "beginner": {
        "avg_score": 2.5,
        "evaluated_answers": 4
      }
    }
  },
  "failure_rates": {
    "hallucination_rate": 0.5,
    "source_omission_rate": 0.875,
    "critical_mechanic_error_rate": 0.25,
    "ambiguous_question_missed_rate": 0.3333,
    "manual_review_count": 4
  },
  "calibration": {
    "manual_eval_mae": 0.0,
    "kendall_tau": 1.0,
    "regression_passed": true,
    "notes": "Example values from manual regression annotations. Live Judge calibration must recompute these."
  }
}
